{
  "schema_version": 1,
  "id": "internet-what-is-the-internet",
  "roadmap": {
    "roadmap_id": "beginner",
    "node": "What is the Internet",
    "category": "Internet Basics",
    "order": 1
  },
  "language": "ru",
  "difficulty": 1,
  "est_minutes": 7,
  "xp": 20,
  "status": "published",
  "title": "Что такое интернет",
  "hook": "Каждое утро ты открываешь мессенджер, новости и музыку — но почти никто не может объяснить, что именно происходит между тобой и сервером. Сегодня разберёмся, из чего на самом деле состоит интернет.",
  "objectives": [
    "Объяснить своими словами, что такое интернет и чем он отличается от веба",
    "Назвать роли клиента, сервера, провайдера и IP-адреса",
    "Понимать, почему интернет называют «сетью сетей»"
  ],
  "theory": [
    {
      "heading": "Сеть сетей",
      "body": "Интернет — это глобальная сеть, которая соединяет миллионы меньших сетей: домашние Wi-Fi, офисные и мобильные сети провайдеров, дата-центры. Отсюда официальное название — «сеть сетей» (network of networks). Каждая маленькая сеть подключается к более крупной через провайдера (ISP — Internet Service Provider), а те — друг к другу через магистральные каналы и точки обмена трафиком. Никто не владеет интернетом целиком: это договорённость тысяч компаний использовать общие протоколы."
    },
    {
      "heading": "Клиент и сервер",
      "body": "Вся работа в интернете строится по модели «запрос — ответ». Когда ты открываешь сайт, твой телефон или компьютер выступает в роли клиента: он отправляет запрос. Сервер — это компьютер в дата-центре, который хранит сайт и отвечает на запрос, присылая страницу, видео или данные API. Одно устройство может быть и тем и другим: твой ноутбук — клиент для сайтов, но «сервер» для принтера в домашней сети."
    },
    {
      "heading": "IP-адреса и домены",
      "body": "Чтобы запрос дошёл до нужного сервера, у каждого устройства в сети есть адрес — IP (например, `142.250.74.14`). Пакеты данных передаются по этому адресу через цепочку роутеров, и на каждом шаге выбирается следующий участок пути (это делает протокол IP). Людям неудобно запоминать числа, поэтому доменные имена вроде `roadmap.sh` переводятся в IP-адреса через DNS — это тема одного из следующих уроков."
    },
    {
      "heading": "Чем интернет отличается от веба",
      "body": "Интернет — это инфраструктура: физические кабели, роутеры, протоколы передачи данных. Веб (World Wide Web) — лишь один из сервисов, работающих поверх неё: сайты, которые ты смотришь в браузере по протоколам HTTP/HTTPS. Кроме веба, по интернету работают электронная почта (SMTP, IMAP), мессенджеры, онлайн-игры, видеозвонки. То есть веб — часть интернета, но не весь интернет."
    }
  ],
  "key_terms": [
    {
      "term": "Интернет",
      "definition": "Глобальная сеть, соединяющая миллионы сетей по общим протоколам (TCP/IP)."
    },
    {
      "term": "Сеть (network)",
      "definition": "Два и более устройства, соединённые для обмена данными."
    },
    {
      "term": "ISP",
      "definition": "Провайдер — компания, дающая тебе доступ в интернет."
    },
    {
      "term": "Клиент",
      "definition": "Устройство или программа, которая отправляет запросы (браузер, приложение)."
    },
    {
      "term": "Сервер",
      "definition": "Компьютер, который хранит данные и отвечает на запросы клиентов."
    },
    {
      "term": "IP-адрес",
      "definition": "Числовой адрес устройства в сети, по которому к нему доставляются пакеты."
    },
    {
      "term": "Веб (WWW)",
      "definition": "Сервис гиперссылок и сайтов поверх интернета, работает по HTTP/HTTPS."
    }
  ],
  "examples": [
    {
      "title": "Аналогия: почтовая система",
      "body": "Интернет устроен похожим образом на обычную почту. Сообщение — это письмо в конверте (пакет данных), IP-адрес — почтовый адрес на конверте, роутеры — сортировочные центры, провайдер — почтовая служба, которая забирает твоё письмо. Сервер — получатель, который читает письмо и отправляет ответ. Слова «клиент» и «сервер» на этой аналогии запоминаются мгновенно."
    },
    {
      "title": "Путь одного запроса",
      "body": "Ты вводишь `example.com` в браузере. Твой запрос идёт: браузер → роутер дома → сеть провайдера → магистральные каналы → дата-центр, где стоит сервер example.com. Ответ возвращается тем же или похожим путём за десятки миллисекунд. Ты не управляешь маршрутом — протоколы делают это сами, разбивая данные на пакеты."
    }
  ],
  "practice": {
    "prompt": "Определи для каждого устройства, клиент он или сервер в конкретной ситуации: (1) твой телефон открывает сайт новостей; (2) компьютер в дата-центре отдаёт эту страницу; (3) твой ноутбук печатает документ на домашнем принтере.",
    "hint": "Клиент — тот, кто просит. Сервер — тот, кто отвечает. Смотри на направление запроса, а не на «важность» устройства.",
    "solution": "(1) Телефон — клиент, сайт новостей — сервер. (2) Компьютер в дата-центре — сервер. (3) Ноутбук — клиент (он отправляет задание на печать), принтер в этот момент выступает сервером. Одно и то же устройство может играть разные роли в зависимости от того, кто кого обслуживает."
  },
  "quiz": [
    {
      "kind": "single",
      "question": "Что такое интернет в самом точном смысле?",
      "options": [
        "Сеть сетей — глобальное объединение миллионов сетей по общим протоколам",
        "World Wide Web — система сайтов и гиперссылок",
        "Компания, владеющая всеми кабелями в мире",
        "Приложение на телефоне для общения"
      ],
      "correct": [0],
      "explanation": "Интернет — это инфраструктура, «сеть сетей». Веб — лишь один из сервисов, работающих поверх неё."
    },
    {
      "kind": "multi",
      "question": "Какие из этих сервисов работают поверх интернета?",
      "options": [
        "Сайты (веб)",
        "Электронная почта",
        "Электрическая розетка в твоём доме",
        "Онлайн-игры"
      ],
      "correct": [0, 1, 3],
      "explanation": "Веб, почта и игры — сервисы поверх интернет-инфраструктуры. Электросеть передаёт ток, а не данные, и к интернету не относится."
    },
    {
      "kind": "single",
      "question": "Кто такой ISP?",
      "options": [
        "Провайдер — компания, через которую ты получаешь доступ в интернет",
        "Международный орган, регулирующий интернет",
        "Разработчик браузеров",
        "Протокол шифрования трафика"
      ],
      "correct": [0],
      "explanation": "ISP (Internet Service Provider) — твой провайдер: он подключает твою домашнюю/мобильную сеть к глобальной."
    },
    {
      "kind": "single",
      "question": "Что делает IP-адрес?",
      "options": [
        "Однозначно адресует устройство в сети, чтобы пакеты дошли до нужного получателя",
        "Шифрует твой пароль при входе на сайт",
        "Ускоряет загрузку видео",
        "Превращает доменное имя в ссылку"
      ],
      "correct": [0],
      "explanation": "IP-адрес — это «почтовый адрес» устройства. По нему роутеры доставляют пакеты. Домен в IP переводит DNS."
    },
    {
      "kind": "single",
      "question": "Твой ноутбук отправляет документ на домашний принтер. Кто здесь клиент?",
      "options": [
        "Ноутбук — он отправляет запрос (задание на печать)",
        "Принтер — он печатает документ",
        "Оба устройства — клиенты",
        "Ни одно: дома нет ни клиентов, ни серверов"
      ],
      "correct": [0],
      "explanation": "Клиент — тот, кто запрашивает услугу. Ноутбук просит принтер напечатать документ, значит ноутбук — клиент, принтер — сервер в этой паре."
    }
  ],
  "pitfalls": [
    "Путать интернет и веб: веб — только один сервис поверх интернета, как и почта или игры.",
    "Считать, что интернетом владеет одна компания или государство — на деле это тысячи сетей по общим протоколам.",
    "Думать, что «клиент» и «сервер» — типы устройств, а не роли: один и тот же компьютер может быть и тем и другим."
  ],
  "sources": [
    {
      "title": "roadmap.sh — Beginner: What is the Internet",
      "url": "https://roadmap.sh/beginner"
    },
    {
      "title": "MDN: How does the Internet work?",
      "url": "https://developer.mozilla.org/en-US/docs/Learn_web_development/Howto/Web_mechanics/How_does_the_Internet_work"
    },
    {
      "title": "Cloudflare: What is the Internet?",
      "url": "https://www.cloudflare.com/learning/network-layer/what-is-the-internet/"
    }
  ],
  "meta": {
    "generated_at": "2026-10-11T14:30:00+06:00",
    "model": "handwritten-reference",
    "prompt_version": "v0"
  }
}